codigo_categoria;categoria;desc_categoria;desc_jurisprudencia;data_disponibilizacao;tribunal;nome_orgao;numero_processo;num_processo_masc;tipo_documento;txt_encontrado;texto;categoria.1;desc_categoria.1;desc_jurisprudencia.1
05-Revisao-Criminal-Legalidad-das-Provas;Revisão Criminal e Legalidade das Provas;Discute a revisão criminal com foco na legalidade das provas e nulidades em processos relacionados a crimes, especialmente tráfico de drogas e porte de arma.;A jurisprudência trata dos embargos de declaração interpostos pela Associação de Ensino e Cultura em face do Município de Aracaju, reconhecendo a omissão ocorrida na aplicação do art. 942 do CPC/2015. O tribunal determinou a necessidade de ampliação do julgamento, uma vez que o voto vencido apresentado poderia modificar o resultado original da apelação. A decisão unânime dos desembargadores demonstra a importância de garantir a efetividade dos recursos e a correta aplicação da legislação processual.  [categoria_antiga] 5;2025-02-21;TJSE;2ª Câmara Cível - 2º Grau;00157694120248250000;nan;acordao;ementa;EMBARGOS DE DECLARAÇÃO CÍVEL NO. ACORDÃO........: 4296/2025 ESCRIVANIA.........: ESCRIVANIA DA 2ª CÂMARA CÍVEL E SEÇÃO ESPECIALIZADA CÍVEL NO. PROCESSO.......202400855209 NÚMERO ÚNICO: 0015769-41.2024.8.25.0000 PROCESSO ORIGEM....202200848801 PROCEDÊNCIA........G-22 GRUPO..............: I RELATOR - G-24 (SIMONE DE OLIVEIRA FRAGA) 1º MEMBRO - G-22 (JOSÉ PEREIRA NETO) 2º MEMBRO - G-21 (MANOEL COSTA NETO EM SUBSTITUIÇÃO A VAGA DE DESEMBARGADOR (G-21)) EMBARGANTE - ASSOCIACAO DE ENSINO E CULTURA PIO DECIMO LTDA ADVOGADO - GUSTAVO DE ANDRADE SANTOS - OAB: 2959/SE ADVOGADO - JANINE MATIAS DE OLIVEIRA SANTOS - OAB: 4440/SE ADVOGADO - ANDIRA DE ALBUQUERQUE SANTANA - OAB: 10422/SE EMBARGADO - MUNICIPIO DE ARACAJU/SE PROCURADOR MUNICIPAL - RAMON ROCHA SANTOS - OAB: 551-A-/SE EMENTA: EMBARGOS DE DECLARAÇÃO EM EMBARGOS DE DECLARAÇÃO - DIREITO CIVIL E PROCESSUAL CIVIL  EMBARGOS DE DECLARAÇÃO - ALEGAÇÃO DE OMISSÃO  ALEGAÇÃO DE QUE NÃO HOUVE APLICAÇÃO DA TÉCNICA DE AMPLIAÇÃO DE JULGAMENTO DO ART. 942 DO CPC NO JULGAMENTO DOS ACLARATÓRIOS ANTERIORES  OMISSÃO EXISTENTE  ENTENDIMENTO DO STJ  NECESSIDADE DE APLICAÇÃO DA TÉCNICA -EMBARGOS DE DECLARAÇÃO CONHECIDOS E PROVIDOS - POR UNANIMIDADE.I  O SUPERIOR TRIBUNAL DE JUSTIÇA JÁ FIRMOU O ENTENDIMENTO DE QUE O PROCEDIMENTO DO ART. 942 DO CPC/2015 APLICA-SE NOS EMBARGOS DE DECLARAÇÃO OPOSTOS AO ACÓRDÃO DE APELAÇÃO QUANDO O VOTO VENCIDO NASCIDO APENAS NOS EMBARGOS FOR SUFICIENTE A ALTERAR O RESULTADO PRIMITIVO DA APELAÇÃO, INDEPENDENTEMENTE DO DESFECHO NÃO UNÂNIME DOS DECLARATÓRIOS (SE REJEITADOS OU SE ACOLHIDOS, COM OU SEM EFEITO MODIFICATIVO), EM RAZÃO DO EFEITO INTEGRATIVO DESTE RECURSO (RESP 1.833.497/TO, RELATOR PARA ACÓRDÃO MINISTRO MARCO AURÉLIO BELLIZZE, TERCEIRA TURMA, DJE DE 1º/9/2020).II - NECESSIDADE DE RETORNO DOS AUTOS PARA AMPLIAÇÃO DE JULGAMENTO DOS ACLARATÓRIOS ANTERIORES.III  RECURSO CONHECIDO E PROVIDO. CONCLUSÃO: VISTOS, RELATADOS E DISCUTIDOS OS PRESENTES AUTOS, ACORDAM OS DESEMBARGADORES DO GRUPO I, DA 2ª CÂMARA CÍVEL DO TRIBUNAL DE JUSTIÇA DO ESTADO DE SERGIPE, POR UNANIMIDADE, EM CONHECER DOS EMBARGOS PARA LHES DAR PROVIMENTO, NOS TERMOS DO PRESENTE JULGADO.;nan;nan;nan
11-Execucao-Fiscal-Seguro-Garantia------;Execucao Fiscal e Seguro Garantia;Trata do uso de seguro garantia em ações de execução fiscal, abordando a validade e condições para sua aceitação em processos judiciais.;A decisão analisada trata-se de uma apelação cível referente a uma execução fiscal movida pelo Município de Aracaju, que foi extinta sem resolução de mérito. O tribunal sustentou que o valor da dívida ativa, inferior a R$ 10.000, classificado como de pequena monta, carecia de interesse processual. A Resolução 547 do CNJ, que estabelece limites para casos semelhantes, e a normativa que regulamenta essa resolução foram citadas como fundamentos. O recurso foi conhecido, mas não provido, mantendo-se a sentença.  Essa decisão destaca a possibilidade de extinção de ações de execução fiscal quando o valor da dívida é ínfimo e não há movimentação processual, seguindo regulamentos do CNJ.;2025-02-21;TJSE;2ª Câmara Cível - 2º Grau;00000626420238250001;nan;acordao;ementa;APELAÇÃO CÍVEL NO. ACORDÃO........: 3999/2025 ESCRIVANIA.........: ESCRIVANIA DA 2ª CÂMARA CÍVEL E SEÇÃO ESPECIALIZADA CÍVEL NO. PROCESSO.......202400872940 NÚMERO ÚNICO: 0000062-64.2023.8.25.0001 PROCESSO ORIGEM....202312200025 PROCEDÊNCIA........22ª VARA CÍVEL DE ARACAJU GRUPO..............: VII RELATOR - G-24 (SIMONE DE OLIVEIRA FRAGA) CONVOCADO - G-22 (JOSÉ PEREIRA NETO) CONVOCADO - G-23 (MARIA ANGÉLICA GARCIA MORENO FRANCO) 1º MEMBRO - G-25 (JOÃO HORA NETO) 2º MEMBRO - G-21 (MANOEL COSTA NETO EM SUBSTITUIÇÃO A VAGA DE DESEMBARGADOR (G-21)) APELANTE - MUNICIPIO DE ARACAJU/SE PROCURADOR MUNICIPAL - ANA EMILIA ALMEIDA PIRES LEAL - OAB: 1393/SE APELADO - WARLEM CATARINO DA SILVA ME EMENTA: APELAÇÃO CÍVEL  EXECUÇÃO FISCAL  EXTINÇÃO SEM RESOLUÇÃO DO MÉRITO  COBRANÇA DE DÉBITO FISCAL PELO MUNICÍPIO DE ARACAJU  SENTENÇA QUE MOTIVOU A EXTINÇÃO DO PROCESSO POR AUSÊNCIA DE INTERESSE PROCESSUAL, POR CONSIDERAR O VALOR DA EXECUÇÃO COMO DE PEQUENA MONTA  TEMA 1184/STF  RESOLUÇÃO 547 DO CNJ QUE ESTABELECE O LIMITE DE R$10.000,00 COMO VALOR ÍNFIMO  CONVÊNIO COM A PROCURADORIA GERAL DO MUNICÍPIO DE ARACAJU  DJO DE 12 DE JUNHO DE 2024 - NORMATIVA Nº 43/2024 QUE REGULAMENTA A RESOLUÇÃO Nº 547/CNJ FEITO SEM MOVIMENTAÇÃO ÚTIL POR MAIS DE 01 ANO - VALOR DA DÍVIDA ATIVA INFERIOR A R$ 10.000,00 - POSSIBILIDADE DE EXTINÇÃO  SENTENÇA MANTIDA  RECURSO CONHECIDO E NÃO PROVIDO. DECISÃO POR MAIORIA. CONCLUSÃO: VISTOS, RELATADOS E DISCUTIDOS ESTES AUTOS, ACORDAM OS DESEMBARGADORES DO GRUPO 7DA 2ª CÂMARA CÍVEL DO TRIBUNAL DE JUSTIÇA DO ESTADO DE SERGIPE, POR MAIORIA DE VOTOS, CONHECER DO RECURSO, PARA LHE NEGAR PROVIMENTO, NA CONFORMIDADE DO VOTO DO RELATOR A SEGUIR, QUE FICA FAZENDO PARTE INTEGRANTE DESTE JULGADO.;nan;nan;nan
12-Agravo-Instrumen-Acao-Declarat-Tutela;Agravo de Instrumento em Ação Declaratória e Tutela;Trata de decisões em agravos de instrumento relacionados a ações declaratórias de inexistência de débitos, incluindo pedidos de tutela antecipada e suspensão de descontos.;O acórdão em questão trata dos embargos de declaração em uma apelação cível, onde a parte autora alegou omissão e contradição no julgamento. O tribunal, no entanto, argumentou que não houve tais falhas, já que o acórdão abordou de forma fundamentada todas as questões relevantes da demanda. A corte ressaltou a impossibilidade de reexame de matéria já discutida e afirmou que não está obrigada a responda a todos os questionamentos das partes, mantendo o entendimento de que o recurso não se enquadra nas hipóteses previstas no Código de Processo Civil.  Os embargos foram conhecidos, mas não providos.;2025-02-21;TJSE;2ª Câmara Cível - 2º Grau;00186465120248250000;nan;acordao;ementa;EMBARGOS DE DECLARAÇÃO CÍVEL NO. ACORDÃO........: 4329/2025 ESCRIVANIA.........: ESCRIVANIA DA 2ª CÂMARA CÍVEL E SEÇÃO ESPECIALIZADA CÍVEL NO. PROCESSO.......202400864321 NÚMERO ÚNICO: 0018646-51.2024.8.25.0000 PROCESSO ORIGEM....202400833108 PROCEDÊNCIA........G-24 GRUPO..............: I RELATOR - G-24 (SIMONE DE OLIVEIRA FRAGA) 1º MEMBRO - G-22 (JOSÉ PEREIRA NETO) 2º MEMBRO - G-21 (MANOEL COSTA NETO EM SUBSTITUIÇÃO A VAGA DE DESEMBARGADOR (G-21)) DIST. VINCULADO AO.: 202400833108 EMBARGANTE - PETROLEO BRASILEIRO S A ADVOGADO - JOSÉ MARCONDES SERVULO DA NOBREGA JUNIOR - OAB: 3817/SE EMBARGADO - ESTADO DE SERGIPE PROCURADOR ESTADUAL - MAURO FERNANDO DOS SANTOS - OAB: 2330/SE EMENTA: EMBARGOS DE DECLARAÇÃO EM APELAÇÃO CÍVEL. AÇÃO DECLARATÓRIA COM PEDIDO DE TUTELA PROVISÓRIA DE URGÊNCIA. RECURSO DO RÉU CONHECIDO E PROVIDO. EMBARGOS DE DECLARAÇÃO OPOSTOS PELA PARTE AUTORA. ALEGAÇÃO DE EXISTÊNCIA DE OMISSÃO E CONTRADIÇÃO NO ACÓRDÃO. INOCORRÊNCIA. ACÓRDÃO EMBARGADO QUE ENFRENTOU, FUNDAMENTADAMENTE, TODAS AS QUESTÕES NECESSÁRIAS PARA O DESLINDE DA DEMANDA. PRETENSÃO DE REEXAME DA MATÉRIA. IMPOSSIBILIDADE. O ÓRGÃO JULGADOR NÃO ESTÁ OBRIGADO A RESPONDER A QUESTIONAMENTOS DAS PARTES, MAS TÃO SÓ A DECLINAR AS RAZÕES DE SEU CONVENCIMENTO MOTIVADO. RECURSO QUE NÃO SE AMOLDA A QUALQUER DAS HIPÓTESES DO ART. 1.022 DO CPC.EMBARGOS CONHECIDOS E NÃO PROVIDOS. CONCLUSÃO: VISTOS, RELATADOS E DISCUTIDOS OS PRESENTES AUTOS, ACORDAM OS INTEGRANTES DO GRUPO I DA 2ª CÂMARA CÍVEL DO TRIBUNAL DE JUSTIÇA DO ESTADO DE SERGIPE, POR UNANIMIDADE, CONHECER DOS EMBARGOS, MAS PARA LHE NEGAR PROVIMENTO, EM CONFORMIDADE COM O RELATÓRIO E VOTO CONSTANTES DOS AUTOS, INTEGRANTES DO PRESENTE JULGADO.;nan;nan;nan
08-Acao-Divorcio-Alimentos--------------;Ação de Divórcio e Alimentos;Trata das questões jurídicas relacionadas ao divórcio litigioso, incluindo regulamentação de guarda, visitas, partilha de bens e fixação de alimentos provisórios.;A apelação cível em questão discute a partilha de bens em um divórcio, especificamente sobre uma empresa de laticínios. A decisão anterior foi considerada extra petita, pois a partilha não foi postulada na petição inicial. Assim, o tribunal anulou a parte da sentença que dispunha sobre a partilha da empresa, em conformidade com o artigo 429 do CPC. O recurso foi conhecido e provido, resultando na reforma pontual da sentença, garantindo que a decisão judicial estivesse em conformidade com o pedido original das partes.   O tema plantea a importância da adequação entre o pedido realizado na ação judicial e a decisão proferida, ressaltando a necessidade do respeito aos limites do que foi solicitado na petição inicial.;2025-02-21;TJSE;2ª Câmara Cível - 2º Grau;00004391520188250032;nan;acordao;ementa;APELAÇÃO CÍVEL NO. ACORDÃO........: 4033/2025 ESCRIVANIA.........: ESCRIVANIA DA 2ª CÂMARA CÍVEL E SEÇÃO ESPECIALIZADA CÍVEL NO. PROCESSO.......202400870444 NÚMERO ÚNICO: 0000439-15.2018.8.25.0032 PROCESSO ORIGEM....201869200494 PROCEDÊNCIA........NOSSA SENHORA DE LOURDES/COMARCA DE GARARU GRUPO..............: IV RELATOR - G-24 (SIMONE DE OLIVEIRA FRAGA) CONVOCADO - G-22 (JOSÉ PEREIRA NETO) CONVOCADO - G-25 (JOÃO HORA NETO) 1º MEMBRO - G-23 (MARIA ANGÉLICA GARCIA MORENO FRANCO) 2º MEMBRO - G-21 (MANOEL COSTA NETO EM SUBSTITUIÇÃO A VAGA DE DESEMBARGADOR (G-21)) APELANTE - JOSÉ MOURA DE FARIAS ROCHA DEFENSOR........DEFENSORIA PÚBLICA APELADO - MARIA ORLANDIA ARAGÃO ROCHA ADVOGADO - OLIVIA CRISTINA EVANGELISTA - OAB: 7513/SE EMENTA: PROCESSO CIVIL. APELAÇÃO CÍVEL. AÇÃO DE DIVÓRCIO. INSURGÊNCIA DA PARTE RESTRITA AO CAPÍTULO DA PARTILHA, ESPECIFICAMENTE QUANTO A EMPRESA DE LATICÍNIOS - NECESSIDADE DE OBSERVÂNCIA DO DISPOSTO NO ART. 429 DO CPC  JULGAMENTO EXTRAPETITA, POSTO QUE NÃO POSTULADA A PARTILHA DE BENS NA PETIÇÃO INICIAL - ANULAÇÃO DE PARTE DO COMANDO SENTENCIAL QUE VERSA SOBRE PARTILHA DA EMPRESA  SENTENÇA EXTRA PETITA NESSE PARTICULAR, IMPONDO-SE DECOTÁ-LA, SOMENTE NESTE PONTO. RECURSO CONHECIDO E PROVIDO. DECISÃO POR MAIORIA. 1. EM ATENÇÃO AO DISPOSTO NO ART.429 DO CPC, IMPÕE-SE RECONHECER O JULGAMENTO EXTRA PETITA E, POR CONSEGUINTE, ANULAR A SENTENÇA NO PONTO REFERENTE À PARTILHA DAEMPRESA DENOMINADA LATICÍNIO TRAIPU, LOCALIZADO NA CIDADE DE TRAIPU/AL, CONFORME MENCIONADO. 2. SENTENÇA PONTUALMENTE REFORMADA. RECURSO CONHECIDO E PROVIDO. CONCLUSÃO: VISTOS, RELATADOS E DISCUTIDOS OS PRESENTES AUTOS, ACORDAM OS INTEGRANTES DO GRUPO II DA SEGUNDA CÂMARA CÍVEL DO TRIBUNAL DE JUSTIÇA DO ESTADO DE SERGIPE, POR MAIORIA DE VOTOS, CONHECER DO RECURSO PARA LHE DAR PROVIMENTO, EM CONFORMIDADE COM O RELATÓRIO E VOTO CONSTANTES DOS AUTOS, QUE FICAM FAZENDO PARTE INTEGRANTE DO PRESENTE JULGADO.;nan;nan;nan
02-Desaforame-Julgament-Crimes-Violentos;Desaforamento de Julgamento em Crimes Violentos;Trata das situações em que há necessidade de deslocar o julgamento de um crime violento, como feminicídio, devido a indícios de parcialidade dos jurados ou influência externa.;[categoria_antiga] 2  A jurisprudência aborda uma apelação criminal envolvendo crimes graves, como estupro de vulnerável e fornecimento de bebida alcoólica a menores. A decisão atribui relevância à vulnerabilidade da vítima, considerando a embriaguez voluntária como um fator que não exclui a capacidade de consentir. A palavra da vítima é destacada como essencial, validando a condenação com base em precedentes do STJ. O acórdão reafirma a responsabilidade dos acusados em crimes sexuais e a aplicação da lei penal, independentemente de contextos que tentem atenuar a culpabilidade.;2025-02-21;TJSE;Câmara Criminal - 2º Grau;00018727920168250014;nan;acordao;ementa;APELAÇÃO CRIMINAL NO. ACORDÃO........: 4274/2025 ESCRIVANIA.........: ESCRIVANIA DA CÂMARA CRIMINAL E TRIBUNAL PLENO NO. PROCESSO.......202400318327 NÚMERO ÚNICO: 0001872-79.2016.8.25.0014 PROCESSO ORIGEM....201664001897 PROCEDÊNCIA........CANINDÉ DE SÃO FRANCISCO RELATOR - G-31 (DIÓGENES BARRETO) REVISOR - G-33 (SUYENE BARRETO SEIXAS DE SANTANA EM SUBSTITUIÇÃO A GILSON FELIX DOS SANTOS) MEMBRO - G-32 (ETÉLIO DE CARVALHO PRADO JUNIOR) APELANTE - M.P.D.E.D.S.................................. APELADO - D.S.D.S................. ADVOGADO - GERD NILTON BAGGENSTOSS GOMES - OAB: 10084/AL APELADO - E.R.C.-.J............................ ADVOGADO - CAMILLA SOARES VILARINS TENÓRIO - OAB: 15509/AL APELADO - M.T.L................ ADVOGADO - GERD NILTON BAGGENSTOSS GOMES - OAB: 10084/AL EMENTA: APELAÇÃO CRIMINAL. CRIMES DE ESTUPRO DE VULNERÁVEL E FORNECIMENTO DE BEBIDA ALCOÓLICA A MENOR DE IDADE (ART. 217- A, § 1º, DO CÓDIGO PENAL E ART. 243 DA LEI Nº 8.069 /90). SENTENÇA ABSOLUTÓRIA. RECURSO EXCLUSIVO DO MINISTÉRIO PÚBLICO. PLEITO DE CONDENAÇÃO DE UMA DAS RÉS CUJA EXTINÇÃO DA PUNIBILIDADE FOI DECLARADA NA AÇÃO PENAL Nº 201864002286, TRANSITADA EM JULGADO EM 16/11/2023. NÃO CONHECIMENTO. DESMEMBRAMENTO DO PROCESSO ANTE A NÃO LOCALIZAÇÃO DA RÉ PELO JUÍZO PRIMEVO. PLEITO DE CONDENAÇÃO QUANTO AO CRIME DE ESTUPRO DE VULNERÁVEL AO PRIMEIRO APELADO. ACOLHIMENTO. JULGAMENTOSOB PERSPECTIVA DE GÊNERO. VULNERABILIDADE NO CASO CONCRETO QUE DIZ RESPEITO À IMPOSSIBILIDADE DE OFERECER RESISTÊNCIA. VÍTIMA QUE, EMBRIAGADA, ACORDOU EM MEIO AO ATO SEXUAL. INCAPACIDADE DE ASSENTIR COM O ATO CONFIRMADA PELO CONJUNTO PROBATÓRIO. EMBRIAGUEZ VOLUNTÁRIA NÃO EXCLUI A VULNERABILIDADE DA VÍTIMA. SITUAÇÃO QUE NÃO SE EQUIPARA A EMBRIAGUEZ PREORDENADA PARA FINS DE NÃO EXCLUSÃO DA RESPONSABILIDADE PENAL. DESNECESSIDADE DE EXIGIR REAÇÃO FÍSICA HERÓICA OU ENÉRGICA PARA CONFIGURAR A RESISTÊNCIA PREVISTA NO TIPO PENAL. PRECEDENTE STJ. DESPICIENDO EXAME TOXICOLÓGICO PARA ATESTAR GRAU DE EMBRIAGUEZ, POIS COMPROVADO POR OUTROS MEIOS (ART. 167, CPP). DESNECESSIDADE DE LAUDO PERICIAL PARA ATESTAR A VIOLÊNCIA FÍSICA, POSTO QUE NÃO HÁ RELATOS DE LESÕES NO CORPO FÍSICO DA VÍTIMA. RELEVÂNCIA DA PALAVRA DA VÍTIMA EM CRIMES SEXUAIS. PRECEDENTES DO STJ E DESTA CORTE. AUTORIA E MATERIALIDADE COMPROVADAS. PALAVRA DA VÍTIMA FIRME E SUSTENTADA POR OUTRAS PROVA E ELEMENTOS INDICIÁRIOS. CONDENAÇÃO QUE SE IMPÕE. PLEITO DE CONDENAÇÃO DE TODOS OS RECORRIDOS QUANTO AO DELITO DE FORNECIMENTO DE BEBIDA ALCOÓLICA A MENOR. ACOLHIDO. CRIME FORMAL QUE NÃO EXIGE RESULTADO NATURALÍSTICO. DESNECESSIDADE DO EFETIVO CONSUMO DA BEBIDA PELA CRIANÇA OU PELO ADOLESCENTE. BEBIDA ALCOÓLICA COLOCADA A DISPOSIÇÃO DAS DUAS ADOLESCENTES. EVENTUAL COMPORTAMENTO PREGRESSO DO MENOR DE IDADE NÃO DESNATURA O CRIME. APLICAÇÃO DAS MESMAS RAZÕES E ENTENDIMENTO DO CRIME DE CORRUPÇÃO DE MENORES, SÚMULA 500, STJ. DESCONHECIMENTO SOBRE A IDADE DAS MENORES NÃO DEMONSTRADO. ERRO DE TIPO UTILIZADO COMO TENTATIVA DE SE EXIMIR DA APLICAÇÃO DA LEI PENAL. IDADE DA VÍTIMA QUE NÃO PODE BENEFICIAR OS AUTORES DO CRIME. CONDENAÇÃO QUE SE IMPÕE. SENTENÇA REFORMADA PARA CONDENAR OS RÉUS. RECURSO PARCIALMENTE CONHECIDO E PROVIDO. CONCLUSÃO: VISTOS, RELATADOS E DISCUTIDOS ESTES AUTOS, ACORDAM OS MEMBROS DA CÂMARA CRIMINAL DESTE EGRÉGIO TRIBUNAL, À UNANIMIDADE, CONHECER PARCIALMENTE DO RECURSO E DAR A ELE PROVIMENTO, EM CONFORMIDADE COM O RELATÓRIO E VOTO CONSTANTES DOS AUTOS, QUE FICAM FAZENDO PARTE INTEGRANTE DO PRESENTE JULGADO.;nan;nan;nan
01-Responsabi-Subsidiari-Acoes-Judiciais;Responsabilidade Subsidiária em Ações Judiciais;Trata das questões relacionadas à responsabilidade subsidiária de entes públicos em execuções trabalhistas e sua relação com a inexigibilidade de títulos executivos judiciais.;[categoria_antiga] 1  A jurisprudência discute embargos declaratórios em uma decisão do Tribunal Regional do Trabalho, onde a parte reclamada buscava reexaminar fatos e provas, porém a Turma afirmou que a via não se presta para tal finalidade. A decisão manteve a condenação da empresa à restituição de valores descontados de salários, com base em decisões do Supremo Tribunal Federal sobre contribuições assistenciais, reiterando que a empregadora é responsável por esse reembolso. O acórdão consolidou a análise completa das matérias.;2025-02-21;TRT3;09ª Turma;00112844520245030134;nan;acordao;acordao;PODER JUDICIÁRIO JUSTIÇA DO TRABALHO TRIBUNAL REGIONAL DO TRABALHO DA 3ª REGIÃO 09ª TURMA Relatora: Maria Stela Alvares da Silva Campos 0011284-45.2024.5.03.0134 : AUTO POSTO K 114 LTDA : GEANE MARIA DA SILVA SANTOS DECISÃO: A Nona Turma, à unanimidade, conheceu dos embargos declaratórios opostos pela reclamada (id. 3d9b43d) porquanto preenchidos os pressupostos de admissibilidade. no mérito, sem divergência, negou-lhes provimento. Em resumo, estes são os FUNDAMENTOS: A leitura da peça de embargos revela que a embargante, indevidamente, deles se utiliza como instrumento de réplica ao acórdão hostilizado, buscando, via oblíqua, o reexame de fatos e provas dos autos, para que seja julgada procedente sua pretensão de reforma da sentença. Esquece-se, entretanto, de que a via ora eleita é integrativa, não se prestando para os fins colimados. A  Turma analisou e decidiu todas as matérias postas a sua definição, proferindo julgado claro, coerente e completo. O Colegiado decidiu por manter a sentença recorrida por seus próprios e jurídicos fundamentos, na forma art. 895 § 1º, IV da CLT, no que se refere à restituição do valor descontado no contracheque de março de 2024 sob a rubrica Desconto Adiantamentos Diversos, bem dos valores descontados nos recibos salariais sob a rubrica Vale Transporte. Aos fundamentos sentenciais, acrescentou: a condenação se limitou à restituição do valor de R$386,32 descontado no contracheque de março de 2024 sob a rubrica Desconto Adiantamentos Diversos (id. 053b6ac - Pág. 13), que não se confunde com o desconto sob a rubrica Desc. Adiantam. Quinzenal, conforme se infere dos contracheques juntados no id. 9dee22e - Pág. 2, o que naufraga de pronto a alegação recursal de id. 06356f0 - Pág. 5. Quanto aos descontos efetuados a título de contribuição assistencial, esta e. Turma também manteve a decisão de origem, mas por fundamentos diversos, expostos no v. acórdão: O Supremo Tribunal Federal julgou constitucional a instituição, por acordo ou convenção coletiva, de contribuições assistenciais para todos os empregados de uma categoria, ainda que não sejam sindicalizados, desde que assegurado o direito de oposição. O entendimento firmado no julgamento de embargos de declaração no Agravo no Recurso Extraordinário (ARE) 1018459, de 11/09/2023, tem repercussão geral reconhecida (Tema 935):É constitucional a instituição, por acordo ou convenção coletivos, de contribuições assistenciais a serem impostas a todos os empregados da categoria, ainda que não sindicalizados, desde que assegurado o direito de oposição. Na espécie, os contracheques juntados noticiam descontos mensais a título de contribuição assistencial (id. 9dee22e e seguintes). E a norma coletiva da categoria não assegura o direito de oposição, conforme se infere da cláusula trigésima sétima da CCT de 2023/2025 (id. cf81bd6 - Pág. 10). Não merece reparos, portanto, a decisão que condenou a empresa a restituir os valores descontados ao título. Ressalto que, tratando-se de desconto salarial, a empregadora é responsável por restituí-lo à empregada (id. d7260e0). Como se vê, a questão foi integral e suficientemente analisada, não havendo vício técnico no acórdão a ensejar provimento declaratório, que, em verdade, é quase uma cópia das razões recursais. Fica evidente o inconformismo da embargante com a decisão, que pode ser manifestado, entretanto, em sede própria, mas incabível em embargos de declaração. Ressalta-se que o Julgador é livre para redigir as decisões que proferir, não sendo obrigado a fazê-lo atendendo às pretensões das partes. Não se reputa omissa, obscura ou contraditória a v. decisão ad quem se a  Turma julga as questões litigiosas de forma diversa ou em sentido contrário ao das teses indicadas pelas partes, não estando, ademais, obrigada a rebatê-las uma a uma, refutando um a um os artigos de lei, súmulas ou teses jurídicas suscitadas pelas partes, mas a indicar os motivos que formaram seu convencimento motivado, tal como se deu na espécie. O que se pode dizer é que a discordância da parte com o resultado do acórdão desafia recurso próprio, hipótese que não se confunde com aquela tratada na Súmula 297 do TST. e se há violações legais e constitucionais nascidas na decisão recorrida, também não é o caso de prequestionamento, conforme expresso na Orientação Jurisprudencial 119 da SDI-1/TST. Nego provimento. BELO HORIZONTE/MG, 19 de fevereiro de 2025.   ALEXIA MARIA MARQUES DE BRITO<br><br>Intimado(s) / Citado(s)<br> - AUTO POSTO K 114 LTDA<br>;nan;nan;nan
11-Execucao-Fiscal-Seguro-Garantia------;Execucao Fiscal e Seguro Garantia;Trata do uso de seguro garantia em ações de execução fiscal, abordando a validade e condições para sua aceitação em processos judiciais.;A decisão discutida refere-se a uma apelação cível em que o Município é o apelante, contestando a extinção de uma execução fiscal de ISS sob alegações de prescrição. O tribunal reconheceu a nulidade da sentença anterior devido à falta de fundamentação na contagem dos prazos prescricionais, conforme o recurso especial repetitivo. A determinação foi pelo retorno dos autos à originária para novo julgamento. Tal situação enfatiza a importância da técnica de fundamentação nas decisões judiciais, especialmente em matéria fiscal.  A jurisprudência destaca a necessidade de os magistrados fundamentarem adequadamente as sentenças, especialmente ao se tratar da contagem de prazos prescricionais, evitando nulidades processuais e garantindo a correta aplicação do direito.;2025-02-21;TJSE;2ª Câmara Cível - 2º Grau;00072340420168250001;nan;acordao;ementa;APELAÇÃO CÍVEL NO. ACORDÃO........: 4067/2025 ESCRIVANIA.........: ESCRIVANIA DA 2ª CÂMARA CÍVEL E SEÇÃO ESPECIALIZADA CÍVEL NO. PROCESSO.......202400868490 NÚMERO ÚNICO: 0007234-04.2016.8.25.0001 PROCESSO ORIGEM....201612000196 PROCEDÊNCIA........20ª VARA CÍVEL DE ARACAJU GRUPO..............: IV RELATOR - G-21 (MANOEL COSTA NETO EM SUBSTITUIÇÃO A VAGA DE DESEMBARGADOR (G-21)) CONVOCADO - G-22 (JOSÉ PEREIRA NETO) CONVOCADO - G-25 (JOÃO HORA NETO) 1º MEMBRO - G-24 (SIMONE DE OLIVEIRA FRAGA) 2º MEMBRO - G-23 (MARIA ANGÉLICA GARCIA MORENO FRANCO) APELANTE - MUNICIPIO DE ARACAJU PROCURADOR MUNICIPAL - ARÍCIO DA SILVA ANDRADE FILHO - OAB: 5371/SE APELADO - VICTORIA CLINICA DE MEDICINA DO TRABALHO EMENTA: APELAÇÃO CÍVEL - EXECUÇÃO FISCAL  ISS  EXTINÇÃO COM RESOLUÇÃO DE MÉRITO, SOB O ARGUMENTO DE PRESCRIÇÃO INTERCORRENTE  PRELIMINAR DE AUSÊNCIA DE FUNDAMENTAÇÃO  MATÉRIA QUE PODE SER ARGUIDA DE OFÍCIO - AUSÊNCIA DE INDICAÇÃO DOS MARCOS TEMPORAIS UTILIZADOS PARA A CONTAGEM DO PRAZO PRESCRICIONAL  INOBSERVÂNCIA DO RECURSO ESPECIAL REPETITIVO Nº 1.340.553/RS (TESE 4.5)  SENTENÇA NULA POR FALTA DE FUNDAMENTAÇÃO INCIDÊNCIA DO ART. 93, INC. IX, DA CONSTITUIÇÃO FEDERAL - DETERMINAÇÃO DE RETORNO DOS AUTOS À ORIGEM - RECURSO CONHECIDO PARA, DE OFÍCIO, SER DECLARADA A NULIDADE DA SENTENÇA.I- CONFORME PRECONIZADO NO RECURSO ESPECIAL REPETITIVO Nº 1.340.553/RS (TESE 4.5), PARA A RECONHECIMENTO DA PRESCRIÇÃO O MAGISTRADO DEVE FUNDAMENTAR O ATO JUDICIAL POR MEIO DA DELIMITAÇÃO DOS MARCOS LEGAIS QUE FORAM APLICADOS NA CONTAGEM DO RESPECTIVO PRAZO, INCLUSIVE QUANTO AO PERÍODO EM QUE A EXECUÇÃO FICOU SUSPENSA.II- RECURSO CONHECIDO PARA, DE OFÍCIO, SER DECLARADA A NULIDADE DA SENTENÇA. POR MAIORIA. CONCLUSÃO: VISTOS, RELATADOS E DISCUTIDOS OS PRESENTES AUTOS, ACORDAM OS INTEGRANTES DESTA 2ª CÂMARA CÍVEL  GRUPO IV, DO TRIBUNAL DE JUSTIÇA DO ESTADO DE SERGIPE, POR MAIORIA, CONHECER PARA, DE OFÍCIO, RECONHECER A NULIDADE DA SENTENÇA E DETERMINAR A BAIXA DOS AUTOS À ORIGEM, PARA NOVO JULGAMENTO OU PROSSEGUIMENTO DA EXECUÇÃO FISCAL, CONFORME ENTENDER O JUIZ A QUO, NOS TERMOS DO VOTO DA RELATORA.;nan;nan;nan
