codigo_categoria;categoria;desc_categoria;desc_jurisprudencia;data_disponibilizacao;tribunal;nome_orgao;numero_processo;num_processo_masc;tipo_documento;txt_encontrado;texto;categoria.1;desc_categoria.1;desc_jurisprudencia.1
17-Acao-Anulatoria-Inadequaca-Via-Eleita;Ação Anulatória e Inadequação da Via Eleita;Trata das questões envolvendo ações anulatórias de acordos judiciais, incluindo aspectos sobre a inadequação da via eletrônica para contestar sentenças já transitadas em julgado.;O recurso trata de uma apelação cível envolvendo a tentativa de anulação de um acordo homologado, cuja sentença já havia transitado em julgado. O relator negou provimento ao recurso, argumentando que a ação anulatória não era cabível, conforme o artigo 966, § 4º do CPC, que estipula que a invalidade dos atos processuais deve considerar a inexistência de coisa julgada. A decisão reafirma a inadequação da via eleita, direcionando a pretensão autoral à ação rescisória.  A análise destaca a limitação da ação anulatória em impugnar acordos homologados, especialmente após o trânsito em julgado, e a necessidade de se observar o cabimento de ações rescisórias para esse tipo de pleito.;2025-02-21;TJSE;2ª Câmara Cível - 2º Grau;00465597320228250001;nan;acordao;ementa;APELAÇÃO CÍVEL NO. ACORDÃO........: 3681/2025 ESCRIVANIA.........: ESCRIVANIA DA 2ª CÂMARA CÍVEL E SEÇÃO ESPECIALIZADA CÍVEL NO. PROCESSO.......202400843886 NÚMERO ÚNICO: 0046559-73.2022.8.25.0001 PROCESSO ORIGEM....202211501273 PROCEDÊNCIA........15ª VARA CÍVEL DE ARACAJU GRUPO..............: VIII RELATOR - G-22 (JOSÉ PEREIRA NETO) CONVOCADO - G-21 (MANOEL COSTA NETO EM SUBSTITUIÇÃO A VAGA DE DESEMBARGADOR (G-21)) CONVOCADO - G-24 (SIMONE DE OLIVEIRA FRAGA) 1º MEMBRO - G-23 (MARIA ANGÉLICA GARCIA MORENO FRANCO) 2º MEMBRO - G-25 (JOÃO HORA NETO) APELANTE - FUNCEF - FUNDACAO DOS ECONOMIARIOS FEDERAIS ADVOGADO - CARLOS EDGAR ANDRADE LEITE - OAB: 4800/SE APELADO - VLADIMIR TEOFILO ASSIS DOS SANTOS ADVOGADO - THIAGO D AVILA FERNANDES - OAB: 155-B-/SE APELADO - JOVAN FRANCISCO DE SALES ADVOGADO - THIAGO D AVILA FERNANDES - OAB: 155-B-/SE APELADO - THIAGO D AVILA FERNANDES ADVOGADO - THIAGO D AVILA FERNANDES - OAB: 155-B-/SE APELADO - THAIS MAIA DE BRITTO FERNANDES ADVOGADO - THIAGO D AVILA FERNANDES - OAB: 155-B-/SE APELADO - JOSELICE DE OLIVEIRA SOUSA NUNES ADVOGADO - THIAGO D AVILA FERNANDES - OAB: 155-B-/SE APELADO - MARCIA DINIZ MENDONÇA ALVES BOMFIM ADVOGADO - THIAGO D AVILA FERNANDES - OAB: 155-B-/SE APELADO - EDMILSON PORTO SANTOS ADVOGADO - THIAGO D AVILA FERNANDES - OAB: 155-B-/SE APELADO - VANEA MARIA MUNIZ BARRETO ADVOGADO - THIAGO D AVILA FERNANDES - OAB: 155-B-/SE APELADO - WASHINGTON DIAS DO NASCIMENTO APELADO - MARIA DE POMPEIA NEGROMONTE FONTES ADVOGADO - EDVANIA SANTANA SANTOS - OAB: 12990/SE APELADO - GENIVALDO SANTOS CONCEIÇÃO ADVOGADO - THIAGO D AVILA FERNANDES - OAB: 155-B-/SE APELADO - RAIMUNDO CALIXTO DE FIGUEIREDO CRUZ ADVOGADO - THIAGO D AVILA FERNANDES - OAB: 155-B-/SE APELADO - VINICIUS TEÓFILO ASSIS DOS SANTOS APELADO - MARIA ELENALDA FELIX DE BRITO ADVOGADO - THIAGO D AVILA FERNANDES - OAB: 155-B-/SE APELADO - MARIA DE FATIMA RODRIGUES BRUNO APELADO - ROSE MARI DE ALMEIDA PEDROSO ADVOGADO - THIAGO D AVILA FERNANDES - OAB: 155-B-/SE APELADO - EDVAN BARRETO SANTOS ADVOGADO - THIAGO D AVILA FERNANDES - OAB: 155-B-/SE EMENTA: APELAÇÃO CÍVEL  AÇÃO ANULATÓRIA DE ACORDO JUDICIAL  SENTENÇA DE INDEFERIMENTO DA PETIÇÃO INICIAL  PRELIMINAR EM CONTRARRAZÕES DE NÃO CONHECIMENTO DO RECURSO POR AUSÊNCIA DE IMPUGNAÇÃO ESPECÍFICA QUANTO AOS FUNDAMENTOS DA SENTENÇA NÃO ACOLHIMENTO - APELANTE QUESTIONA OS FUNDAMENTOS DE FATO E DE DIREITO DA SENTENÇA - PRETENSÃO AUTORAL DE ANULAR ACORDO HOMOLOGADO POR SENTENÇA JÁ TRANSITADA EM JULGADO  NÃO CABIMENTO DA AÇÃO ANULATÓRIA - OBSERVÂNCIA DO ART. 966, § 4º DO CPC  CABIMENTO DE AÇÃO RESCISÓRIA  INADEQUAÇÃO DA VIA ELEITA  MANUTENÇÃO DA SENTENÇA  RECURSO CONHECIDO E DESPROVIDO.  O ART. 966, § 4º SE REFERE À INVALIDAÇÃO DOS ATOS JURÍDICOS PROCESSUAIS REALIZADOS PELAS PARTES OU POR OUTROS SUJEITOS DO PROCESSO E HOMOLOGADOS PELO JUIZ, OS QUAIS, NO ENTANTO, DEVEM TER COMO PRESSUPOSTO A INEXISTÊNCIA DE COISA JULGADA. CONCLUSÃO: VISTOS, RELATADOS E DISCUTIDOS OS AUTOS DA PRESENTE APELAÇÃO CÍVEL, ACORDAM OS INTEGRANTES DA 2ª CÂMARA CÍVEL DO TRIBUNAL DE JUSTIÇA DO ESTADO DE SERGIPE, EM CONHECER DO RECURSO, PARA NEGAR PROVIMENTO,NA CONFORMIDADE DO VOTO DO RELATOR A SEGUIR, QUE FICA FAZENDO PARTE INTEGRANTE DESTE JULGADO.;nan;nan;nan
08-Acao-Divorcio-Alimentos--------------;Ação de Divórcio e Alimentos;Trata das questões jurídicas relacionadas ao divórcio litigioso, incluindo regulamentação de guarda, visitas, partilha de bens e fixação de alimentos provisórios.;A decisão revela um caso de apelação cível em matéria de direito de família, especificamente relacionado à revisão de alimentos. A sentença anterior foi considerada parcial, levando ambas as partes a recorrerem. O tribunal reconheceu cerceamento de defesa devido à inversão da ordem de atos processuais e à ausência de contraditório na produção de prova pericial. Com isso, o recurso do réu foi provido, anulando a sentença e remanescendo os autos à instância inferior para regular processamento. A parte autora teve seu apelo julgado prejudicado.  A análise destaca a importância do devido processo legal, evidenciando que a ausência de contraditório e cerceamento de defesa podem levar à anulação de decisões judiciais. Este caso ilustra como aspectos processuais e direitos fundamentais influenciam os resultados em ações de revisão de alimentos.;2025-02-21;TJSE;2ª Câmara Cível - 2º Grau;00097433720228250084;nan;acordao;ementa;APELAÇÃO CÍVEL NO. ACORDÃO........: 4307/2025 ESCRIVANIA.........: ESCRIVANIA DA 2ª CÂMARA CÍVEL E SEÇÃO ESPECIALIZADA CÍVEL NO. PROCESSO.......202400823275 NÚMERO ÚNICO: 0009743-37.2022.8.25.0084 PROCESSO ORIGEM....202214900967 PROCEDÊNCIA........19ª VARA CÍVEL DE ARACAJU GRUPO..............: IX RELATOR - G-25 (JOÃO HORA NETO) 1º MEMBRO - G-22 (JOSÉ PEREIRA NETO) 2º MEMBRO - G-24 (SIMONE DE OLIVEIRA FRAGA) DIST. VINCULADO AO.: 202300863482 APELANTE - Z.S............ ADVOGADO - RICARDO MARQUES FARIAS FREIRE - OAB: 6644/SE APELANTE - Z.S.J.................. ADVOGADO - MONALIZA DA SILVA SOUZA VILA NOVA - OAB: 7244/SE APELANTE - F.C.S....................... ADVOGADO - MONALIZA DA SILVA SOUZA VILA NOVA - OAB: 7244/SE APELADO - Z.S............ ADVOGADO - RICARDO MARQUES FARIAS FREIRE - OAB: 6644/SE APELADO - Z.S.J.................. ADVOGADO - MONALIZA DA SILVA SOUZA VILA NOVA - OAB: 7244/SE APELADO - F.C.S....................... ADVOGADO - MONALIZA DA SILVA SOUZA VILA NOVA - OAB: 7244/SE EMENTA: APELAÇÕES CÍVEIS. DIREITO CIVIL. DIREITO DE FAMÍLIA. AÇÃO REVISIONAL DE ALIMENTOS. SENTENÇA DE PARCIAL PROCEDÊNCIA. RECURSO DE AMBAS AS PARTES. APELO DO RÉU. PRELIMINARMENTE NULIDADE. INVERSÃO DA ORDEM DOS ATOS. PERÍCIA APÓS AUDIÊNCIA. PREJUÍZO NÃO DEMONSTRADO. CERCEAMENTO DE DEFESA. AUSÊNCIA DE CONTRADITÓRIO QUANTO À PRODUÇÃO DE PROVA PERICIAL. DICÇÃO DO ART. 477, §1º DO CPC. PRAZO PARA APRESENTAÇÃO DE ALEGAÇÕES FINAIS SUPRIMIDO. ART. 364, §2º, DO CPC. CERCEAMENTO DE DEFESA RECONHECIDO. APELO PARTE DA AUTORA PREJUDICADO. RETORNO DOS AUTOS À ORIGEM.ANULAÇÃO DA SENTENÇA. CONCLUSÃO: VISTOS, RELATADOS E DISCUTIDOS OS PRESENTES AUTOS, ACORDAM OS INTEGRANTES DA 2A CÂMARA CÍVEL  GRUPO IX, DO TRIBUNAL DE JUSTIÇA DO ESTADO DE SERGIPE, À UNANIMIDADE DE VOTOS, EM CONHECER DO RECURSO DO RÉU PARA LHE DAR PROVIMENTO, A FIM DE ANULAR A SENTENÇA, COM REMESSA DOS AUTOS À ORIGEM PARA REGULAR PROCESSAMENTO, E JULGAR PREJUDICADO O APELO DA PARTE ADVERSA, NOS TERMOS DO VOTO DO RELATOR.;nan;nan;nan
12-Agravo-Instrumen-Acao-Declarat-Tutela;Agravo de Instrumento em Ação Declaratória e Tutela;Trata de decisões em agravos de instrumento relacionados a ações declaratórias de inexistência de débitos, incluindo pedidos de tutela antecipada e suspensão de descontos.;O acórdão em questão envolve uma apelação cível na qual se discute uma ação de exigir contas. O ponto central é a deserção em função do não recolhimento integral do preparo recursal. O tribunal reafirma que, conforme o artigo 1.007, § 5º do CPC, a complementação do preparo não é permitida quando o pagamento inicial é insuficiente, resultando na preclusão consumativa. As alegações de erro material não justificam a exceção à regra, levando ao não conhecimento do recurso por unanimidade.  A decisão destaca a rigidez do sistema processual em relação ao recolhimento correto do preparo, reforçando a necessidade de atender estritamente aos prazos e requisitos legais para viabilizar a admissibilidade do recurso. A jurisprudência é um guia importante para garantir a eficácia do processo civil.  [categoria_antiga] 12;2025-02-21;TJSE;2ª Câmara Cível - 2º Grau;00035711420198250075;nan;acordao;ementa;APELAÇÃO CÍVEL NO. ACORDÃO........: 4304/2025 ESCRIVANIA.........: ESCRIVANIA DA 2ª CÂMARA CÍVEL E SEÇÃO ESPECIALIZADA CÍVEL NO. PROCESSO.......202400847136 NÚMERO ÚNICO: 0003571-14.2019.8.25.0075 PROCESSO ORIGEM....201985001819 PROCEDÊNCIA........1ª VARA CÍVEL E CRIMINAL DE TOBIAS BARRETO GRUPO..............: VIII RELATOR - G-22 (JOSÉ PEREIRA NETO) 1º MEMBRO - G-23 (MARIA ANGÉLICA GARCIA MORENO FRANCO) 2º MEMBRO - G-25 (JOÃO HORA NETO) DIST. VINCULADO AO.: 202200817681 APELANTE - LAISLON CESAR DORIA COSTA ADVOGADO - CRISTIANO PINHEIRO BARRETO - OAB: 3656/SE ADVOGADO - VALTENO ALVES MENEZES NETO - OAB: 13989/SE APELADO - ASSOCIAÇÃO DOS ESTUDANTES UNIVERSITÁRIOS DE TOBIAS BARRETO ADVOGADO - AIRTON OLIVEIRA DE ANDRADE - OAB: 9637/SE INTERESSADO - DANILO SANTOS MARTINS ADVOGADO - AIRTON OLIVEIRA DE ANDRADE - OAB: 9637/SE EMENTA: APELAÇÃO CÍVEL  AÇÃO DE EXIGIR CONTAS - DESERÇÃO  PREPARO  INTIMAÇÃO PARA RECOLHIMENTO EM DOBRO  PAGAMENTO PARCIAL  COMPLEMENTAÇÃO POSTERIOR  IMPOSSIBILIDADE  PRECLUSÃO CONSUMATIVA  ART. 1.007, § 5º, DO CPC  NÃO CONHECIMENTO DO RECURSO- UNÂNIME. O PREPARO É PRESSUPOSTO RECURSAL DE ADMISSIBILIDADE, DEVENDO SER RECOLHIDO INTEGRALMENTE NO PRAZO LEGAL OU NA INTIMAÇÃO PARA PAGAMENTO EM DOBRO. NOS TERMOS DO ART. 1.007, § 5º, DO CPC, É VEDADA A COMPLEMENTAÇÃO POSTERIOR DO PREPARO QUANDO O RECOLHIMENTO INICIAL FOR INSUFICIENTE, CONFIGURANDO A PRECLUSÃO CONSUMATIVA. ALEGAÇÕES DE ERRO MATERIAL NO PAGAMENTO PARCIAL NÃO AFASTAM A APLICAÇÃO DA PENALIDADE DE DESERÇÃO, SOBRETUDO QUANDO NÃO COMPROVADAS JUSTIFICATIVAS PLAUSÍVEIS QUE AUTORIZEM EXCEÇÕES À REGRA. PRECEDENTES DO SUPERIOR TRIBUNAL DE JUSTIÇA CONSOLIDAM QUE A COMPLEMENTAÇÃO FORA DOS LIMITES LEGAIS INVIABILIZA A ADMISSIBILIDADE DO RECURSO. RECURSO NÃO CONHECIDO . CONCLUSÃO: VISTOS, RELATADOS E DISCUTIDOS OS PRESENTES AUTOS, ACORDAM OS MEMBROS DO GRUPO 8, DA 2ª CÂMARA CÍVEL DESTE TRIBUNAL DE JUSTIÇA DO ESTADO DE SERGIPE, POR UNANIMIDADE DE VOTOS, EM NÃO CONHECER DO RECURSO, NOS TERMOS DO RELATÓRIO E VOTO QUE FAZEM PARTE INTEGRANTE DESTE JULGADO.;nan;nan;nan
14-Responsabilida-Transacoes-Financeiras;Responsabilidade em Transações Financeiras;Trata da responsabilidade de instituições financeiras em transações realizadas pelos usuários, incluindo aspectos sobre a falha na prestação de serviços e a relação de causalidade entre danos e ações das instituições.;A jurisprudência em questão refere-se a uma apelação cível onde o banco é responsabilizado por fraudes em conta corrente da consumidora. A sentença original reconheceu a falha na prestação de serviço bancário, determinando o ressarcimento dos danos materiais, embora não tenha configurado o dano moral devido à culpa concorrente. O recurso do banco foi parcialmente provido, mantendo o dever de indenização por perdas financeiras. O caso destaca a importância da proteção ao consumidor e a responsabilidade das instituições financeiras em suas operações.  A análise salienta a reflexão sobre a necessidade de mecanismos eficazes de segurança em transações financeiras, garantindo a proteção das contas dos consumidores e a responsabilidade das instituições em casos de fraudes.;2025-02-21;TJSE;2ª Câmara Cível - 2º Grau;00606723220228250001;nan;acordao;ementa;APELAÇÃO CÍVEL NO. ACORDÃO........: 4309/2025 ESCRIVANIA.........: ESCRIVANIA DA 2ª CÂMARA CÍVEL E SEÇÃO ESPECIALIZADA CÍVEL NO. PROCESSO.......202400867971 NÚMERO ÚNICO: 0060672-32.2022.8.25.0001 PROCESSO ORIGEM....202311200246 PROCEDÊNCIA........12ª VARA CÍVEL DE ARACAJU GRUPO..............: III RELATOR - G-23 (MARIA ANGÉLICA GARCIA MORENO FRANCO) 1º MEMBRO - G-21 (MANOEL COSTA NETO EM SUBSTITUIÇÃO A VAGA DE DESEMBARGADOR (G-21)) 2º MEMBRO - G-22 (JOSÉ PEREIRA NETO) APELANTE - BANCO DO ESTADO DE SERGIPE S.A. BANESE ADVOGADO - ISABELLE SANTIAGO ALMEIDA - OAB: 3763/SE APELADO - GRASIELA MENDONÇA DE OLIVEIRA ADVOGADO - LEANDRO LISBOA OLIVIERA - OAB: 14601/SE EMENTA: APELAÇÃO CÍVEL. AÇÃO ORDINÁRIA. DIVERSAS TRANSAÇÕES FINANCEIRAS EFETUADAS DA CONTA DA AUTORA. SENTENÇA DE PROCEDÊNCIA. IRRESIGNAÇÃO DO BANCO RÉU. OPERAÇÕES E VALORES QUE DESTOARAM DO PERFIL DA CONSUMIDORA. AUSÊNCIA DE MECANISMOS QUE OBSTASSEM TRANSAÇÕES COM APARÊNCIA DE ILEGALIDADE. FRAUDE CONSTATADA. EVIDENTES A FALHA NA PRESTAÇÃO DO SERVIÇO POR PARTE DO BANCO REQUERIDO E O PREJUÍZO DE ALTA MONTA SUPORTADO PELA REQUERENTE. DANO MORAL NÃO CONFIGURADO, ANTE O RECONHECIMENTO DA CULPA CONCORRENTE ENTRE AS PARTES. REFORMA DA SENTENÇA APENAS NESSE PONTO. DANOS MATERIAIS COMPROVADOS. PREJUÍZO CAUSADO EM DECORRÊNCIA DE ATO ILÍCITO, POR MEIO DE FRAUDE NA CONTA DA DEMANDANTE, QUE DEVE SER RESSARCIDO PELA INSTITUIÇÃO BANCÁRIA. PRECEDENTES DESTA CORTE DE JUSTIÇA. RECURSO CONHECIDO E PARCIALMENTE PROVIDO. UNANIMIDADE. CONCLUSÃO: VISTOS, RELATADOS E DISCUTIDOS OS AUTOS, ACORDAM, POR UNANIMIDADE DE VOTOS, OS MEMBROS DO GRUPO III, DA 2ª CÂMARA CÍVEL DO EGRÉGIO TRIBUNAL DE JUSTIÇA DO ESTADO DE SERGIPE, EM CONHECER DO RECURSO EM APREÇO PARA LHE DAR PARCIAL PROVIMENTO, NA CONFORMIDADE DO VOTO DO RELATOR A SEGUIR QUE FICA FAZENDO PARTE INTEGRANTE DESTE JULGADO.;nan;nan;nan
07-Acao-Obrigacao-Fazer-Tutela-Antecipad;Ação de Obrigação de Fazer e Tutela Antecipada;Trata das ações judiciais que visam a obrigação de fazer com a solicitação de tutela antecipada, especialmente em casos relacionados à saúde e planos de saúde.;A apelação cível analisada envolve uma ação de obrigação de fazer, com pedido de tutela de urgência, relacionado a um plano de saúde. O paciente, diagnosticado com Transtorno do Espectro Autista (TEA), demandou cobertura para acompanhamento por meio do método ABA, baseando-se na Resolução 539/22 da ANS. A decisão judicial reconheceu a obrigatoriedade da cobertura de métodos indicados pelo médico, mas não constatou a configuração de dano moral, resultando em reforma parcial da sentença com base em precedentes. Recursos foram desprovistos por unanimidade.  A jurisprudência trata das obrigações de planos de saúde em fornecer cobertura a tratamentos indicados para condições específicas, analisando a legalidade de cláusulas contratuais e resoluções normativas. Como um desdobramento, examina-se a legitimidade de solicitações de danos morais e as condições para comprovação do mesmo em casos de inadimplemento contratual.;2025-02-21;TJSE;2ª Câmara Cível - 2º Grau;00179400220238250001;nan;acordao;ementa;APELAÇÃO CÍVEL NO. ACORDÃO........: 4306/2025 ESCRIVANIA.........: ESCRIVANIA DA 2ª CÂMARA CÍVEL E SEÇÃO ESPECIALIZADA CÍVEL NO. PROCESSO.......202400856966 NÚMERO ÚNICO: 0017940-02.2023.8.25.0001 PROCESSO ORIGEM....202310200543 PROCEDÊNCIA........2ª VARA CÍVEL DE ARACAJU GRUPO..............: IV RELATOR - G-23 (MARIA ANGÉLICA GARCIA MORENO FRANCO) 1º MEMBRO - G-21 (MANOEL COSTA NETO EM SUBSTITUIÇÃO A VAGA DE DESEMBARGADOR (G-21)) 2º MEMBRO - G-24 (SIMONE DE OLIVEIRA FRAGA) DIST. VINCULADO AO.: 202300825977 APELANTE - IGOR IURY JURUBEBA SANTOS ADVOGADO - VALDERICE GOMES DA SILVA - OAB: 10428/SE APELANTE - HAPVIDA ASSISTENCIA MEDICA S.A ADVOGADO - IGOR MACEDO FACO - OAB: 16470/CE APELADO - IGOR IURY JURUBEBA SANTOS ADVOGADO - VALDERICE GOMES DA SILVA - OAB: 10428/SE APELADO - HAPVIDA ASSISTENCIA MEDICA S.A ADVOGADO - IGOR MACEDO FACO - OAB: 16470/CE EMENTA: APELAÇÃO CÍVEL. AÇÃO DE OBRIGAÇÃO DE FAZER C/C PEDIDO DE TUTELA DE URGÊNCIA C/C DANO MORAL E MATERIAL. PLANO DE SAÚDE. PACIENTE DIAGNOSTICADO COM TEA (TRANSTORNO DO ESPECTRO AUTISTA). INDICAÇÃO DE ACOMPANHAMENTO POR MEIO DO MÉTODO ABA. SENTENÇA DE PARCIAL PROCEDÊNCIA. IRRESIGNAÇÃO DAS PARTES. RESPONSABILIDADE DE COBERTURA. RESOLUÇÃO 539/22, DA ANS. OBRIGATORIEDADE DA COBERTURA DE QUAISQUER MÉTODOS OU TÉCNICAS INDICADOS PELO MÉDICO PARA TRANSTORNOS DO ESPECTRO AUTISTA. CERTIFICAÇÃO BCBA NÃO É OBRIGATÓRIA NO BRASIL. COMPROVAÇÃO DE ESPECIALIZAÇÃO OU CERTIFICAÇÃO EM MESTRADO ABA OU CERTIFICAÇÃO INTERNACIONAL BCBA PARA PROFISSIONAL DE PSICOLOGIA NÃO ENCONTRA RESPALDO NO ROL DA ANS, TAMPOUCO NO CONTRATO FIRMADO PELAS PARTES. DANO MORAL. NÃO CONFIGURADO. INADIMPLEMENTO CONTRATUAL. AUSÊNCIA DE COMPROVAÇÃO DO ABALO PSICOLÓGICO. REFORMA PARCIAL DA SENTENÇA. PRECEDENTES DO STJ E DESSE EGRÉGIO TRIBUNAL. RECURSOS DESPROVIDOS. DECISÃO UNÂNIME. CONCLUSÃO: VISTOS, RELATADOS E DISCUTIDOS OS PRESENTES AUTOS, ACORDAM OS INTEGRANTES DO GRUPO IV, DA SEGUNDA CÂMARA CÍVEL, DO TRIBUNAL DE JUSTIÇA DO ESTADO DE SERGIPE, POR UNANIMIDADE, CONHECER DO RECURSO PARA NEGAR-LHES PROVIMENTO, EM CONFORMIDADE COM O RELATÓRIO E VOTO CONSTANTES DOS AUTOS, QUE FICAM FAZENDO PARTE INTEGRANTE DO PRESENTE JULGADO.;nan;nan;nan
01-Responsabi-Subsidiari-Acoes-Judiciais;Responsabilidade Subsidiária em Ações Judiciais;Trata das questões relacionadas à responsabilidade subsidiária de entes públicos em execuções trabalhistas e sua relação com a inexigibilidade de títulos executivos judiciais.;A jurisprudência trata da questão do piso salarial para tecnólogos, abordando a compatibilidade da formação do reclamante com a Lei 4.950-A/66. O tribunal reconheceu que, apesar de não ser registrado no CREA, o autor tem direito a diferenças salariais conforme sua qualificação em tecnologia em gestão ambiental. Assim, a decisão manteve a condenação da empresa ao pagamento das diferenças, calculadas a partir do piso salarial previsto e conforme os reajustes determinados por lei, excluindo, no entanto, a multa da CLT.   O tema central envolve o direito a piso salarial, com base nas qualificações profissionais, refletindo a aplicação das leis trabalhistas em relação a diferentes formações.;2025-02-21;TRT3;09ª Turma;00103552620225030152;nan;acordao;ementa;PODER JUDICIÁRIO JUSTIÇA DO TRABALHO TRIBUNAL REGIONAL DO TRABALHO DA 3ª REGIÃO 09ª TURMA Relator: Rodrigo Ribeiro Bueno 0010355-26.2022.5.03.0152 : BLACK & DECKER DO BRASIL LTDA E OUTROS (1) : DIEGO HENRIQUE ANTUNES E OUTROS (1) EMENTA: TECNÓLOGO. PISO SALARIAL. LEI Nº 9.450-A/66. ADPF 53. Não importa para o deslinde da causa que o reclamante não seja engenheiro registrado no CREA. Com efeito, o diploma anexado aos autos revela que o autor é graduado em curso superior de tecnologia em gestão ambiental, ou seja, em curso superior de tecnólogo de menor duração do que o bacharelado ou licenciatura. Ora, a Lei 4.950-A/66 estabelece piso salarial também para os diplomados pelos cursos regulares superiores mantidos pelas Escolas de Engenharia, de Química, de Arquitetura, de Agronomia e de Veterinária com curso universitário de menos de 4 (quatro) anos, conforme se vê na alínea b do art. 4º e na parte final do art. 5º deste diploma legal. Mantém-se a condenação da ré ao pagamento de diferenças salariais, que deverão observar os ditames da ADPF 53.  DECISÃO: A Nona Turma, à unanimidade, conheceu dos recursos das partes. no mérito, sem divergência, negou provimento ao recurso do reclamante. deu provimento parcial ao recurso da reclamada para: a) determinar que as diferenças deferidas ao autor sejam apuradas entre o salário da época da contratação e o piso salarial estabelecido na parte final do art. 5º da Lei 4.950-A/1966 (5 salários mínimos vigentes na época), com posteriores reajustes legais, espontâneos ou normativos (não mais os do salário mínimo), sendo ainda devidos os reflexos deferidos em sentença. e b) excluir da condenação o pagamento da multa prevista no artigo 477, §8º da CLT. manteve o valor da condenação porque ainda compatível. BELO HORIZONTE/MG, 19 de fevereiro de 2025.   ALEXIA MARIA MARQUES DE BRITO<br><br>Intimado(s) / Citado(s)<br> - BLACK & DECKER DO BRASIL LTDA<br>;nan;nan;nan
16-Direito-Propried-Responsa-das-Concess;Direito de Propriedade e Responsabilidade das Concessionárias;Análise sobre os direitos de propriedade e a responsabilidade das concessionárias em atender as demandas que impactam diretamente na utilização de bens individuais e coletivos, abordando remoções de estruturas em desacordo com a legislação.;A apelação cível versa sobre a responsabilidade da concessionária de energia elétrica em custear a remoção de poste que limita o direito de propriedade do apelado. O tribunal concluiu que a instalação inadequada do poste compromete o exercício do direito de propriedade, e, portanto, deve ser custeada pela concessionária. Por outro lado, não foram considerados danos morais, já que os aborrecimentos não configuraram abalos psicológicos significativos. O recurso foi conhecido e provido parcialmente, mantendo o prazo de 90 dias para a execução da diligência.  A jurisprudência aborda a premissa de que prestadoras de serviços não podem restringir direitos de propriedade sem a devida necessidade comunitária. A decisão reafirma a obrigação de minimizar impactos sobre a propriedade individual e delimita os critérios necessários para reconhecimento de danos morais, estabelecendo que meros dissabores não geram direito a indenização.;2025-02-21;TJSE;2ª Câmara Cível - 2º Grau;00006001820248250031;nan;acordao;ementa;APELAÇÃO CÍVEL NO. ACORDÃO........: 4311/2025 ESCRIVANIA.........: ESCRIVANIA DA 2ª CÂMARA CÍVEL E SEÇÃO ESPECIALIZADA CÍVEL NO. PROCESSO.......202400867914 NÚMERO ÚNICO: 0000600-18.2024.8.25.0031 PROCESSO ORIGEM....202469000596 PROCEDÊNCIA........GARARU GRUPO..............: IX RELATOR - G-22 (JOSÉ PEREIRA NETO) 1º MEMBRO - G-24 (SIMONE DE OLIVEIRA FRAGA) 2º MEMBRO - G-25 (JOÃO HORA NETO) APELANTE - ENERGISA SERGIPE DISTRIBUIDORA DE ENERGIA S/A ADVOGADO - RODRIGO NÓBREGA FARIAS - OAB: 10220/PB APELADO - MARIA ELANE CRISTINA DOS SANTOS ADVOGADO - ANSELMO JOSE ALBUQUERQUE DE MELO - OAB: 11873/SE EMENTA: APELAÇÃO CÍVEL. CONCESSIONÁRIA DE ENERGIA ELÉTRICA. REMOÇÃO DE POSTE DE SUSTENTAÇÃO DA REDE DE ENERGIA. LIMITAÇÃO AO DIREITO DE PROPRIEDADE. DEVER DA PRESTADORA DE SERVIÇOS CUSTEAR A OBRA. DANO MORAL NÃO CONFIGURADO. REFORMA PONTUAL DO COMANDO SENTENCIAL. RECURSO CONHECIDO E PROVIDO PARCIALMENTE.- A PRESTAÇÃO DE SERVIÇOS DE ENERGIA ELÉTRICA DEVE SER REALIZADA DE FORMA A NÃO RESTRINGIR O EXERCÍCIO DO DIREITO DE PROPRIEDADE INDIVIDUAL, SE NÃO ESTRITAMENTE NECESSÁRIO AO BEM DA COLETIVIDADE.- VERIFICADO QUE A DISPOSIÇÃO DO POSTE QUE SUPORTA A REDE DE ENERGIA ELÉTRICA IMPEDE OU DIFICULTA A PASSAGEM DE VEÍCULO PARA A GARAGEM, IMPÕE-SE A SUA REMOÇÃO, SENDO O ÔNUS DA OBRA ASSUMIDO PELA CONCESSIONÁRIA. DESSARTE, NA ESPÉCIE A INSTALAÇÃO DO POSTE DE ENERGIA ELÉTRICA EM LOCAL INAPROPRIADO COMPROMETE O LEGÍTIMO EXERCÍCIO DO DIREITO DE PROPRIEDADE. EM SENDO NECESSÁRIO O DESLOCAMENTO DO POSTE PARA PERMITIR O PLENO EXERCÍCIO DO DIREITO DE PROPRIEDADE, REFERIDA OBRA SE INSERE NO ÂMBITO DOS CUSTOS DA PRESTAÇÃO DE SERVIÇOS E NÃO PODE SER IMPOSTA AO AUTOR.- NÃO CONFIGURAM DANOS MORAIS OS MEROS ABORRECIMENTOS E DISSABORES DO DIA-A-DIA, SENDO NECESSÁRIO, PARA QUE SURJA O DIREITO À COMPENSAÇÃO, QUE HAJA INTENSO ABALO PSICOLÓGICO OU À IMAGEM, CAPAZ DE AGREDIR O LESADO EM SUA HONRA, SUA REPUTAÇÃO, SUA PERSONALIDADE. NO CASO VERTENTE, NÃO RESTOU CONFIGURADO O DANO MORAL, MAS SIM MERO DISSABOR, NÃO COMPORTANDO O DEVER DE INDENIZAÇÃO, NA MEDIDA EM QUE NÃO RESTOU COMPROVADA A EXISTÊNCIA DE DANO GRAVE SUPORTADO PELO AUTOR.- COM REFERÊNCIA AO PRAZO ASSINALADO, TEM-SE QUE O ESTIPULADO PELO JULGADOR (90 DIAS) REVELA-SE RAZOÁVEL PARA CUMPRIMENTO DA DILIGÊNCIA. LOGO, DEVE SER MANTIDO.- RECURSO PROVIDO PARCIALMENTE. CONCLUSÃO: VISTOS, RELATADOS E DISCUTIDOS ESTES AUTOS, ACORDAM OS DESEMBARGADORES DA 2ª CÂMARA CÍVEL, POR UNANIMIDADE, EM CONHECER DA PRESENTE APELAÇÃO CÍVEL PARA LHE DAR PROVIMENTO PARCIAL, NA CONFORMIDADE DO VOTO DA RELATORA A SEGUIR, QUE FICA FAZENDO PARTE INTEGRANTE DESTE JULGADO;nan;nan;nan
