codigo_categoria;categoria;desc_categoria;desc_jurisprudencia;data_disponibilizacao;tribunal;nome_orgao;numero_processo;num_processo_masc;tipo_documento;txt_encontrado;texto;categoria.1;desc_categoria.1;desc_jurisprudencia.1
02-Desaforame-Julgament-Crimes-Violentos;Desaforamento de Julgamento em Crimes Violentos;Trata das situações em que há necessidade de deslocar o julgamento de um crime violento, como feminicídio, devido a indícios de parcialidade dos jurados ou influência externa.;O texto trata do desaforamento de um julgamento em um caso de feminicídio tentado. O pedido foi realizado pelo Ministério Público devido à suspeita de parcialidade dos jurados, que teriam mantido contato com pessoas ligadas ao réu para favorecimento. A decisão do tribunal concedeu o desaforamento, transferindo o julgamento para uma vara criminal diferente, embasado em evidências concretas apresentadas, incluindo gravações que corroboraram as preocupações sobre a imparcialidade do júri.  O desaforamento é uma medida excepcional que garante a imparcialidade no julgamento de crimes, especialmente em casos sensíveis como a violência doméstica. Este procedimento é aplicado quando há indícios de que o júri não poderá avaliar o caso de forma justa devido a influências externas, assegurando que os direitos do acusado e a integridade do processo legal sejam respeitados.;2025-02-21;TJSE;Secretaria Judiciária;00198451120248250000;nan;acordao;ementa;DESAFORAMENTO DE JULGAMENTO NO. ACORDÃO........: 4523/2025 ESCRIVANIA.........: ESCRIVANIA DA CÂMARA CRIMINAL E TRIBUNAL PLENO NO. PROCESSO.......202400168107 NÚMERO ÚNICO: 0019845-11.2024.8.25.0000 PROCESSO ORIGEM....202082000946 PROCEDÊNCIA........RIBEIRÓPOLIS RELATOR - G-31 (DIÓGENES BARRETO) DIST. VINCULADO AO.: 202100334422 AUTOR - M.P.D.E.D.S.................................. RÉU - E.A.D.M................. ADVOGADO - SAULO DE ARAÚJO LIMA - OAB: 4290/SE ADVOGADO - MARIA ROZINETE DE JESUS - OAB: 13103/SE EMENTA: PEDIDO DE DESAFORAMENTO.JURI.VIOLÊNCIA DOMÉSTICA.CRIME DE FEMINICIDIO NA FORMA TENTADA. REQUERIMENTO DO MEMBRO DO MINISTÉRIO PÚBLICO QUE ATUA NA COMARCA DE ORIGEM. INDÍCIOS DE DÚVIDAS QUANTO À PARCIALIDADE DOS JURADOS. PESSOAS LIGADAS AO RÉU QUE MANTIVERAM CONTATO COM ALGUNS DOS JURADOS SORTEADOS PARA PARTICIPAR DA SESSÃO DO JÚRI COM O OBJETIVO DE FAVORECIMENTO. CONFIRMAÇÃO POR PARTE DOS JURADOS PROCURADOS. EXISTÊNCIA DE ELEMENTOS CONCRETOS QUE AUTORIZAM A MEDIDA EXCEPCIONAL, INCLUSIVE ÁUDIO POR MEIO DE APLICATIVO. VALIDADE E RELEVÂNCIA DAS INFORMAÇÕES PRESTADAS PELO JUÍZO A QUO. INDÍCIOS DE DÚVIDAS QUANTO À IMPARCIALIDADE DOS JURADOS DEMONSTRADOS. DEFERIMENTO DA MUTATIO FORI. PRECEDENTES DESTA CORTE E DO STJ. DESAFORAMENTO DEFERIDO PARA UMA DAS VARAS CRIMINAIS DA COMARCA DE ITABAIANA/SE. CONCLUSÃO: VISTOS, RELATADOS E DISCUTIDOS OS PRESENTES AUTOS, ACORDAM OS INTEGRANTES DO TRIBUNAL DE JUSTIÇA DO ESTADO DE SERGIPE, EM SUA COMPOSIÇÃO PLENÁRIA, À UNANIMIDADE, EM CONHECER E DEFERIR O PEDIDO DE DESAFORAMENTO FORMULADO PELO MINISTÉRIO PÚBLICO, EM CONFORMIDADE COM O RELATÓRIO E VOTO CONSTANTES DOS AUTOS, QUE FICAM FAZENDO PARTE INTEGRANTE DO PRESENTE JULGADO.;nan;nan;nan
03-Mandado-Injuncao-Revisao-Normas------;Mandado de Injuncao e Revisao de Normas;Trata das decisões relacionadas a mandados de injunção que visam a revisão de normas em âmbito municipal, especialmente no que diz respeito aos direitos dos servidores públicos e à regulamentação de suas remunerações.;O mandado de injunção analisado trata da revisão geral das remunerações de servidores públicos municipais, especificamente para os anos de 2013 e 2014. A decisão reconhece a mora legislativa em razão da ausência de regulamentação do artigo 37, inciso X, da Constituição Federal, que assegura a recomposição salarial. A jurisprudência reafirma que o Poder Judiciário não pode obrigar o Executivo a propor lei para a revisão salarial, conferindo caráter vinculante às decisões do STF. Assim, determina-se a intimação do município para manifestação fundamentada sobre a recomposição salarial.  O tema é essencial para entender a dinâmica entre os poderes, a regulamentação das remunerações dos servidores e as limitações do Judiciário em relação ao Poder Executivo. O processo ilustra a importância da defesa de direitos decorrentes da Constituição e as implicações da mora legislativa nos ajustes salariais.;2025-02-21;TJSE;Secretaria Judiciária;00129586020148250000;nan;acordao;ementa;MANDADO DE INJUNÇÃO NO. ACORDÃO........: 3499/2025 ESCRIVANIA.........: ESCRIVANIA DA CÂMARA CRIMINAL E TRIBUNAL PLENO NO. PROCESSO.......201400126626 NÚMERO ÚNICO: 0012958-60.2014.8.25.0000 RELATOR - (ANA BERNADETE LEITE DE CARVALHO ANDRADE) IMPETRANTE - CAMILA MONTEIRO DA SILVA ALMEIDA ADVOGADO - LUCAS MENDONCA RIOS - OAB: 3938/SE IMPETRADO - PREFEITO DO MUNICIPIO DE LAGARTO ADVOGADO - SILVANA YARA DE CASTRO SOUZA RODRIGUES - OAB: 4693/SE EMENTA: MANDADO DE INJUNÇÃO  SERVIDOR PÚBLICO MUNICIPAL  REVISÃO GERAL DOS ANOS 2013 E 2014  ALEGAÇÃO DE AUSÊNCIA DE REGULAMENTAÇÃO DO ART. 37, INCISO X, DA CONSTITUIÇÃO FEDERAL E DE PERDAS INFLACIONÁRIAS  PRETENSÃO DE RECONHECIMENTO DE MORA LEGISLATIVA  MORA CARACTERIZADA - ADEQUAÇÃO AO JULGADO DO RE 843112/SP PELO STF - TEMA 624 - REPERCUSSÃO GERAL - REVISÃO DO ACÓRDÃO, NOS TERMOS DO ART. 1.030, II, DO CPC - CARÁTER VINCULANTE DAS DECISÕES PROFERIDAS EM SEDE DE REPECURSÃO GERAL - IMPOSSIBILIDADE DE DETERMINAÇÃO DE EDIÇÃO DE NORMA AO EXECUTIVO - DECISÃO LIMITADA À DECLARAÇÃO DA MORA E INTIMAÇÃO DO MUNICÍPIO COM FINS DE MANIFESTAÇÃO, DE FORMA FUNDAMENTADA, SOBRE A CONVENIÊNCIA E POSSIBILIDADE DA RECOMPOSIÇÃO SALARIAL AO FUNCIONALISMO. PARCIAL ORDEM AO MANDADO DE INJUNÇÃO.I - TEMA 624: O PODER JUDICIÁRIO NÃO POSSUI COMPETÊNCIA PARA DETERMINAR AO PODER EXECUTIVO A APRESENTAÇÃO DE PROJETO DE LEI QUE VISE A PROMOVER A REVISÃO GERAL ANUAL DA REMUNERAÇÃO DOS SERVIDORES PÚBLICOS, TAMPOUCO PARA FIXAR O RESPECTIVO ÍNDICE DE CORREÇÃO.. (RE 843112/SP)II - REFORMA PARCIAL DO ACÓRDÃO PROFERIDO EM 26/04/2017 PARA ADEQUAÇÃO AOS TERMOS DO TEMA 624 DO STF, DE CARÁTER VINCULANTE, FORTE NO ARTIGO 1.030, II, DO CPC CONCLUSÃO: VISTOS, RELATADOS E DISCUTIDOS ESTES AUTOS, ACORDAM OS MEMBROS DESTE EGRÉGIO TRIBUNAL DE JUSTIÇA, POR UNANIMIDADE, EM DAR PARCIAL ORDEM DE INJUNÇÃO, EM CONFORMIDADE COM O RELATÓRIO E VOTO, CONSTANTES DOS AUTOS, QUE FICAM FAZENDO PARTE INTEGRANTE DO PRESENTE JULGADO.;nan;nan;nan
04-Acumulacao-Cargos-Publicos-----------;Acumulação de Cargos Públicos;Aborda as questões relacionadas à acumulação de cargos públicos e as limitações impostas pela Constituição Federal, bem como as exceções previstas para sua admissibilidade.;O mandado de segurança em questão aborda a pretensão de acumulação de cargos públicos, especificamente entre o cargo de guarda municipal e o de técnico de necropsia, e a expressa vedação na Constituição Federal. A decisão enfatiza a interpretação restritiva das exceções permitidas, conforme a Emenda Constitucional nº 101/2019, que não abrange essa equiparação. A falta de direito líquido e certo levou à denegação do pedido, evidenciando a rigidez nas normas de acumulação de cargos no serviço público.  A jurisprudência reflete sobre a limitação da acumulação de cargos públicos, estabelecendo critérios rigorosos e exceções quando aplicáveis. Ressalta a necessidade de esclarecimento das condições em que é possível o exercício simultâneo dessas funções, garantindo a observância da legalidade e dos direitos no setor público.;2025-02-21;TJSE;Secretaria Judiciária;00185149120248250000;nan;acordao;ementa;MANDADO DE SEGURANÇA CÍVEL NO. ACORDÃO........: 4524/2025 ESCRIVANIA.........: ESCRIVANIA DA CÂMARA CRIMINAL E TRIBUNAL PLENO NO. PROCESSO.......202400163910 NÚMERO ÚNICO: 0018514-91.2024.8.25.0000 RELATOR - G-22 (JOSÉ PEREIRA NETO) IMPETRANTE - CLAUDIO ROBERTO ALVES DE SANTANA ADVOGADO - JUCELIA GONÇALVES LIMA - OAB: 5347/SE IMPETRADO - SECRETÁRIA DE ESTADO DA ADMINSTRAÇÃO DO ESTADO DE SERGIPE INTERESSADO - ESTADO DE SERGIPE EMENTA: MANDADO DE SEGURANÇA - ACUMULAÇÃO DE CARGOS PÚBLICOS - EXCEÇÃO PREVISTA NA CONSTITUIÇÃO FEDERAL - PRETENSÃO DO EXERCÍCIO SIMULTÂNEO DO CARGO DE GUARDA MUNICIPAL DE ARACAJU E TÉCNICO DE NECROPSIA DO ESTADO DE SERGIPE - TESE DE EQUIPARAÇÃO DO CARGO DE GUARDA MUNICIPAL AO CARGO DE POLICIAL MILITAR ESTADUAL PARA FINS DE ABRANGÊNCIA DA EC Nº 101/2019 - INADMISSIBILIDADE - AUSÊNCIA DE DIREITO LÍQUIDO E CERTO  DENEGAÇÃO DA ORDEM. DECISÃO UNÂNIMEMANDADO DE SEGURANÇA IMPETRADO PARA ASSEGURAR A ACUMULAÇÃO DO CARGO DE GUARDA MUNICIPAL DE ARACAJU COM OUTRO DE TÉCNICO DE NECROPSIA DO ESTADO DE SERGIPE.ACUMULAÇÃO DE CARGOS SOMENTE ADMITIDA PELA CONSTITUIÇÃO FEDERAL EM CARÁTER EXCEPCIONAL CONFORME ENUMERAÇÃO TAXAVA DE CARGOS.A EC Nº 101/2019, ACRESCENTOU § 3º AO ART. 42 DA CONSTITUIÇÃO FEDERAL PARA ESTENDER AOS MILITARES DOS ESTADOS, DO DISTRITO FEDERAL E DOS TERRITÓRIOS O DIREITO À ACUMULAÇÃO DE CARGOS PÚBLICOS PREVISTA NO ART. 37, INCISO XVI.IMPETRANTE QUE OCUPA CARGO DE GUARDA MUNICIPAL, NÃO SENDO ADMITIDA A INTERPRETAÇÃO EXTENSIVA PARA FINS DE EQUIPARAÇÃO COM O CARGO DE POLICIAL MILITAR ESTADUAL.INADMISSIBILIDADE DO EXERCÍCIO SIMULTÂNEO DO CARGO DE GUARDA MUNICIPAL COM OUTRO DE NATUREZA TÉCNICA OU CIENTÍFICA.DENEGAÇÃO DA ORDEM, ANTE A AUSÊNCIA DE DIREITO LÍQUIDO E CERTO A SER TUTELADO CONCLUSÃO: VISTOS, RELATADOS E DISCUTIDOS ESTES AUTOS, ACORDAM OS MEMBROS DESTE EGRÉGIO TRIBUNAL DE JUSTIÇA DO ESTADO DE SERGIPE, EM SESSÃO PLENÁRIA E, POR UNANIMIDADE, DENEGAR A SEGURANÇA IMPETRADA, EM CONFORMIDADE COM O RELATÓRIO E VOTO CONSTANTES DOS AUTOS, QUE FICAM FAZENDO PARTE INTEGRANTE DO PRESENTE JULGADO.;nan;nan;nan
05-Revisao-Criminal-Legalidad-das-Provas;Revisão Criminal e Legalidade das Provas;Discute a revisão criminal com foco na legalidade das provas e nulidades em processos relacionados a crimes, especialmente tráfico de drogas e porte de arma.;A jurisprudência aborda a revisão criminal relacionada a condenação por tráfico de drogas, associação para o tráfico e porte ilegal de arma. O relator e revisor sustentaram a legalidade das provas obtidas sem mandado judicial, em virtude de flagrante decorrente de denúncias. O pedido de absolvição e a nulidade do julgamento foram considerados improcedentes, ressaltando a manutenção da condenação. O tribunal decidiu, por unanimidade, improcedente a revisão, reforçando a validade das decisões anteriores e a legalidade das evidências apresentadas.  A revisão criminal, conforme abordado, destaca a possibilidade de reavaliação de sentenças penais em situações onde se alega a ilegalidade das provas. Envolve um procedimento onde a parte recorrente tenta atingir a absolvição ou revisar condenações, analisando vícios processuais ou novas evidências que possam alterar o entendimento da corte sobre o caso. É um importante mecanismo no sistema judicial que busca garantir justiça e a correta aplicação da lei.;2025-02-21;TJSE;Secretaria Judiciária;00118954820248250000;nan;acordao;ementa;REVISÃO CRIMINAL NO. ACORDÃO........: 3473/2025 ESCRIVANIA.........: ESCRIVANIA DA CÂMARA CRIMINAL E TRIBUNAL PLENO NO. PROCESSO.......202400143131 NÚMERO ÚNICO: 0011895-48.2024.8.25.0000 PROCESSO ORIGEM....202021900401 PROCEDÊNCIA........2ª VARA CRIMINAL DE ARACAJU RELATOR - (ANA BERNADETE LEITE DE CARVALHO ANDRADE) REVISOR - (CRISTIANO JOSÉ MACEDO COSTA EM SUBSTITUIÇÃO A RICARDO MÚCIO SANTANA DE ABREU LIMA) DIST. VINCULADO AO.: 202100323893 RECORRENTE - ROBSON PEREIRA SOUZA ADVOGADO - JURACI NUNES DE CARVALHO JUNIOR - OAB: 11713/SE RECORRIDO - MINISTERIO PUBLICO DO ESTADO DE SERGIPE EMENTA: REVISÃO CRIMINAL  CRIME DE TRÁFICO DE DROGAS C/C ASSOCIAÇÃO PARA O TRÁFICO, EM CONCURSO MATERIAL COM PORTE ILEGAL DE ARMA DE FOGO DE USO PERMITIDO, COM RECEPÇÃO (ART. 33 E 35 DA LEI N° 11.343/2006 C/C ART. 69, CP - ART. 12, LEI N° 10.826/2003 C/C ART. 180, CP)  PLEITO DE ABSOLVIÇÃO  ALEGAÇÃO DE NULIDADE DO JULGAMENTO PELA SUPOSTA ILICITUDE DAS PROVAS COLHIDAS EM BUSCA E APREENSSÃO REALIZADAS POR POLICIAIS  INVIOLABIDADE DO DOMÍCILIO SEM QUE HAJA MANDADO JUDICIAL  DESCABIMENTO  CRIME DE TRÁFICO FLAGRANTE QUE OCORREU EM VIRTUDE DE INFORMAÇÕES OBTIDAS POR DENÚNCIAS  REALIZAÇÃO DE VIGILÂNCIA, COM POSTERIOR APREENSÃO  CRIME PERMANENTE  CASO QUE NÃO DISTOA DO TEMA 280/STF  LEGALIDADE DAS PROVAS OBTIDAS  PEDIDO SUBSIDIÁRIO DE AFASTAMENTO DA ASSOCIAÇÃO PARA O TRÁFICO  INVIABILIDADE  PROVAS DO CONLUIO PARA A TRAFICÂNCIA NO INTERIOR DO ESTADO  TEMAS JÁ ENFRENTADOS EM SEDE DE APELAÇÃO CRIMINAL  REVISÃO UTILIZADA COMO SUCEDÂNEO RECURSAL DA APELAÇÃO QUE MANTEVE SENTENÇA CONDENATÓRIA  MANUTENÇÃO DA CONDENAÇÃO - IMPROCEDÊNCIA DO PEDIDO REVISIONAL. CONCLUSÃO: VISTOS, RELATADOS E DISCUTIDOS OS PRESENTES AUTOS, ACORDAM OS MEMBROS DO TRIBUNAL DE JUSTIÇA DO ESTADO DE SERGIPE, POR UNANIMIDADE, EM JULGAR IMPROCEDENTE A PRESENTE REVISÃO CRIMINAL, EM CONFORMIDADE COM O RELATÓRIO E VOTO CONSTANTES DOS AUTOS, QUE FICAM FAZENDO PARTE INTEGRANTE DO PRESENTE JULGADO.;nan;nan;nan
05-Revisao-Criminal-Legalidad-das-Provas;Revisão Criminal e Legalidade das Provas;Discute a revisão criminal com foco na legalidade das provas e nulidades em processos relacionados a crimes, especialmente tráfico de drogas e porte de arma.;[categoria_antiga] 5    A análise trata da prescrição intercorrente no âmbito do direito do trabalho, abordando um caso específico onde a aplicação dessa prescrição foi considerada inaplicável. O Tribunal Regional do Trabalho entendeu que a decretação de prescrição exigia a intimação do exequente para cumprimento de determinação judicial durante a execução. A decisão reafirmou que a contagem do prazo para prescrição intercorrente só se inicia após tal intimação, conforme previsto na Lei nº 13.467/2017, enfatizando a necessidade da atividade do exequente em procedimentos judiciais.;2025-02-21;TRT7;Seção Especializada II;00004514420165070034;nan;acordao;ementa;PODER JUDICIÁRIO JUSTIÇA DO TRABALHO TRIBUNAL REGIONAL DO TRABALHO DA 7ª REGIÃO SEÇÃO ESPECIALIZADA II Relator: CARLOS ALBERTO TRINDADE REBONATTO AP 0000451-44.2016.5.07.0034 AGRAVANTE: JOSE ELMA DE SOUSA AGRAVADO: J.A COSTA PEREIRA E OUTROS (2) EMENTA DIREITO DO TRABALHO. AGRAVO DE PETIÇÃO DO EXEQUENTE. PRESCRIÇÃO INTERCORRENTE. NÃO OCORRÊNCIA. DECISÃO REFORMADA. I. CASO EM EXAME 1. Agravo de petição do exequente em face da decisão que reconheceu a prescrição intercorrente e extinguiu a execução. II. QUESTÃO EM DISCUSSÃO 2. A questão em discussão consiste em saber se merece subsistir a decretação da prescrição intercorrente no presente caso. III. RAZÕES DE DECIDIR 3. O processo foi remetido ao arquivo provisório sem qualquer intimação do exequente para cumprimento de determinação judicial no curso da execução, sendo inviável a aplicação da prescrição intercorrente ao caso. IV. DISPOSITIVO E TESE 4. Agravo de petição conhecido e provido. Tese de julgamento: A prescrição intercorrente no processo do trabalho exige intimação expressa do exequente para cumprimento de determinação judicial no curso da execução. Dispositivos relevantes citados: CLT, art. 11-A. TST, Instrução Normativa nº 41/2018. Jurisprudência relevante citada: TRT-7, AP 0001291-90.2011.5.07.0014, Relator JEFFERSON QUESADO JUNIOR, Seção Especializada II, p. 27/12/2022.   RELATÓRIO Trata-se de agravo de petição (ID. fa1a8cb) interposto pelo exequente JOSE ELMA DE SOUSA contra a sentença (ID. 07cd089) da Única Vara do Trabalho de Eusébio que reconheceu a prescrição intercorrente e extinguiu a execução. Em suas razões recursais alega o agravante que não merece subsistir a decretação da prescrição intercorrente e requer o prosseguimento da execução. Os executados, notificados, não apresentaram contraminuta. Dispensada a remessa dos autos ao Ministério Público do Trabalho. É o relatório.   FUNDAMENTAÇÃO   ADMISSIBILIDADE Presentes os pressupostos legais de admissibilidade, conheço do agravo de petição interposto.   MÉRITO Conforme relatado, insurge-se o exequente contra a decisão que aplicou a prescrição intercorrente. Examina-se. Com a edição da Lei nº 13.467/2017, intitulada Reforma Trabalhista, o art. 11-A foi acrescentado à CLT, autorizando expressamente a aplicação da prescrição intercorrente ao processo do trabalho, no prazo de dois anos, a contar do momento que o exequente deixa de cumprir determinação judicial no curso da execução: Art. 11-A. Ocorre a prescrição intercorrente no processo do trabalho no prazo de dois anos. (Incluído pela Lei nº 13.467, de 2017) § 1º A fluência do prazo prescricional intercorrente inicia-se quando o exequente deixa de cumprir determinação judicial no curso da execução. (Incluído pela Lei nº 13.467, de 2017) § 2º A declaração da prescrição intercorrente pode ser requerida ou declarada de ofício em qualquer grau de jurisdição. Registre-se que o C. TST editou a Instrução Normativa nº 41/2018, que dispõe sobre a aplicação das normas processuais da CLT alteradas pela Lei nº 13.467/2017. O art. 2º da referida instrução prevê que O fluxo da prescrição intercorrente conta-se a partir do descumprimento da determinação judicial a que alude o § 1º do art. 11-A da CLT, desde que feita após 11 de novembro de 2017. Da análise detida dos autos, não se vislumbra descumprimento de determinação judicial no curso da execução pelo exequente (art. 11-A, § 1º, da CLT). No caso em questão, o processo foi remetido ao arquivo provisório após o despacho de ID. 577723f, sem qualquer intimação do exequente para cumprimento de determinação judicial no curso da execução e sem qualquer menção à possibilidade de aplicação da prescrição intercorrente. Assim, inviável a aplicação da prescrição intercorrente ao caso. Nesse sentido, o seguinte julgado: AGRAVO DE PETIÇÃO - EXECUÇÃO - EXTINÇÃO - PRESCRIÇÃO INTERCORRENTE - INAPLICABILIDADE. Considerando-se que o fluxo da prescrição intercorrente será contado a partir do descumprimento da determinação judicial, desde que expedida após 11/11/2017, data de início da vigência da Reforma Trabalhista e que o reconhecimento da prescrição só se dará após expressa intimação do exequente (parte vencedora da ação) para cumprimento de determinação judicial no curso da execução, providências não implementadas no presente caso, patente que não restou demonstrado o desinteresse da exequente, o que impede a declaração da prescrição intercorrente. Agravo de Petição conhecido e provido para determinar o prosseguimento da execução (TRT-7, AP: 0001291-90.2011.5.07.0014, Relator(a): JEFFERSON QUESADO JUNIOR, Seção Especializada II. p. 27/12/2022) Assim, não se pode entender que o reclamante tenha ficado inerte pelo prazo aludido no art. 11-A da CLT, sendo inviável a aplicação da prescrição intercorrente ao caso. Ante todo o exposto, impõe-se a reforma da decisão recorrida para afastar a prescrição intercorrente, com o retorno dos autos à Vara de origem para prosseguimento da execução. É como voto.   CONCLUSÃO DO VOTO Voto por conhecer do agravo de petição e, no mérito, dar-lhe provimento para afastar a prescrição intercorrente, determinando o retorno dos autos à Vara de origem para prosseguimento da execução.   DISPOSITIVO ACORDAM OS INTEGRANTES DA SEÇÃO ESPECIALIZADA II DO TRIBUNAL REGIONAL DO TRABALHO DA 7ª REGIÃO por unanimidade,conhecer do agravo de petição e, no mérito, dar-lhe provimento para afastar a prescrição intercorrente, determinando o retorno dos autos à Vara de origem para prosseguimento da execução. Participaram do julgamento os Desembargadores Emmanuel Teófilo Furtado (Presidente), Durval César de Vasconcelos Maia, Francisco José Gomes da Silva, Clóvis Valença Alves Filho e Carlos Alberto Trindade Rebonatto (Relator). Presente na sessão, ainda, o(a) ilustre representante do Ministério Público do Trabalho, Dr(a) Carlos Leonardo Holanda Silva. Fortaleza, 28 de janeiro de 2025. CARLOS ALBERTO TRINDADE REBONATTO Desembargador Relator   FORTALEZA/CE, 19 de fevereiro de 2025. JOSE WANLEY LIMA DE CASTRO Diretor de Secretaria<br><br>Intimado(s) / Citado(s)<br> - JOSE ELMA DE SOUSA<br>;nan;nan;nan
05-Revisao-Criminal-Legalidad-das-Provas;Revisão Criminal e Legalidade das Provas;Discute a revisão criminal com foco na legalidade das provas e nulidades em processos relacionados a crimes, especialmente tráfico de drogas e porte de arma.;Análise do caso revela que a revisão criminal foi indeferida. A recorrente, condenada por tráfico de drogas, argumentou que a quantidade de maconha estava abaixo do limite estabelecido pelo Supremo Tribunal Federal para consumo pessoal. Contudo, o tribunal evidenciou que as circunstâncias da apreensão indicavam tráfico, já que a droga estava pronta para ser entregue a outra pessoa. Assim, a decisão destacou a inaplicabilidade da descriminalização, considerando a intenção de distribuição da substância.   [categoria_antiga] 5;2025-02-21;TJSE;Secretaria Judiciária;00196883820248250000;nan;acordao;ementa;REVISÃO CRIMINAL NO. ACORDÃO........: 4525/2025 ESCRIVANIA.........: ESCRIVANIA DA CÂMARA CRIMINAL E TRIBUNAL PLENO NO. PROCESSO.......202400167592 NÚMERO ÚNICO: 0019688-38.2024.8.25.0000 PROCESSO ORIGEM....202221900391 PROCEDÊNCIA........1ª VARA CRIMINAL DE ARACAJU RELATOR - G-15 (ANA LÚCIA FREIRE DE ALMEIDA DOS ANJOS) REVISOR - G-32 (ETÉLIO DE CARVALHO PRADO JUNIOR) DIST. VINCULADO AO.: 202300349012 RECORRENTE - LEANDRA SANTOS DE SANTANA ADVOGADO - ANNIELLY SOUZA PRIMO - OAB: 8031/SE RECORRIDO - MINISTERIO PUBLICO DO ESTADO DE SERGIPE EMENTA: PENAL E PROCESSUAL PENAL. REVISÃO CRIMINAL. REVISIONANDA CONDENADA PELA PRÁTICA DO CRIME PREVISTO NO ARTIGO 33 § 4º C/C O ART. 40, III, DA LEI 11.343/2006 (TRÁFICO DE DROGAS PRIVILEGIADO), CUJA SENTENÇA FOI MANTIDA INTEGRALMENTE EM SEDE DE APELAÇÃO CRIMINAL NA CÂMARA CRIMINAL DESTE TRIBUNAL DE JUSTIÇA. PRETENSÃO ABSOLUTÓRIA LASTREADA NO JULGAMENTO DO RECURSO EXTRAORDINÁRIO N. 635.659/SP (TEMA 506) DO SUPREMO TRIBUNAL FEDERAL, QUE DESCRIMINALIZOU O PORTE DE MACONHA PARA CONSUMO PESSOAL  INVIABILIDADE NA HIPÓTESE EM TESTILHA  PRESUNÇÃO RELATIVA DA CONDIÇÃO DE USUÁRIA - CIRCUNTÂNCIAS ENVOLVENDO O DELITO APONTAM QUE A DROGA SE DESTINAVA À TRAFICÂNCIA E NÃO AO USO PESSOAL - RÉ QUE, EMBORA TENHA SIDO FLAGRADA COM QUANTIDADE DE MACONHA INFERIOR AO LIMITE ESTABELECIDO NA REFERIDA DECISÃO DO STF, TENTAVA INGRESSAR EM ESTABELECIMENTO PRISIONAL COM A SUBSTÂNCIA ENTORPECENTE ACONDICIONADA EM PEQUENOS INVÓLUCROS NO SEU ESTÔMAGO, VISANDO EFETIVAMENTE ENTREGAR AO SEU COMPANHEIRO  RELATIVIDADE DA CONDIÇÃO DE MERA USUÁRIA QUE DEVE SER AFASTADA NO CASO CONCRETO  ELEMENTOS PERFILHADOS APTOS À CONFIGURAÇÃO DA MERCANCIA DE DROGAS, QUE NÃO AUTORIZA A APLICABILIDADE DO MENCIONADO LEADING CASE DA SUPREMA CORTE. PRECEDENTES. REVISÃO CRIMINAL IMPROCEDENTE. DECISÃO UNÂNIME. CONCLUSÃO: VISTOS, RELATADOS E DISCUTIDOS OS PRESENTES AUTOS, ACORDAM OS INTEGRANTES DO TRIBUNAL DE JUSTIÇA DO ESTADO DE SERGIPE, EM SESSÃO PLENÁRIA E, POR UNANIMIDADE, JULGAR IMPROCEDENTE A PRESENTE REVISÃO CRIMINAL, EM CONFORMIDADE COM O RELATÓRIO E VOTO CONSTANTES DOS AUTOS, QUE FICAM FAZENDO PARTE INTEGRANTE DO PRESENTE JULGADO.;nan;nan;nan
